<?xml version="1.0" ?><ciudad xmlns="http://www.example.org/ejercicio1-2" xmlns:xsi="http://www.w3.org/2001/XMLSchema-instance" xsi:schemaLocation="http://www.example.org/ejercicio1-2 ../xml/ejercicio1-2.xsd" codigo="2520058"><nombre>Cartagena</nombre><pais>Spain</pais><poblacion>211996</poblacion><ubicacion><latitud>37.60512</latitud><longitud>-0.98623</longitud></ubicacion><dbpedia>http://dbpedia.org/resource/Cartagena%2C_Spain</dbpedia><wikipedia>https://en.wikipedia.org/wiki/Cartagena%2C_Spain</wikipedia><fechaactualizacion>2012-03-04</fechaactualizacion><informacionmeteorologica><fechayhora>2019-04-26T22:00:00</fechayhora><nombreestacion>International airport of the Region of Murcia</nombreestacion><temperatura>14.0</temperatura><nubes>no clouds detected</nubes></informacionmeteorologica><sitio codigo="10860321"><nombre>Parque Maestranza de Artilleria</nombre></sitio><sitio codigo="10280776"><nombre>Museo Histórico Militar de Cartagena</nombre></sitio><sitio codigo="10280775"><nombre>Parque Arqueológico Cerro del Molinete</nombre></sitio><sitio codigo="10280774"><nombre>Barrio del Foro Romano</nombre></sitio><sitio codigo="6505996"><nombre>SERCOTEL Carlos III</nombre></sitio><sitio codigo="10170453"><nombre>Sercotel Alfonso Xiii Ex-Best Western</nombre></sitio><sitio codigo="6483755"><nombre>Sercotel Alfonso XIII</nombre></sitio><sitio codigo="10400375"><nombre>Plaza San Francisco</nombre></sitio><sitio codigo="6482678"><nombre>HUSA CARTAGONOVA Hotel &amp; Spa</nombre></sitio></ciudad>