<?xml version="1.0" ?><ciudad xmlns="http://www.example.org/ejercicio1-2" xmlns:xsi="http://www.w3.org/2001/XMLSchema-instance" xsi:schemaLocation="http://www.example.org/ejercicio1-2 ../xml/ejercicio1-2.xsd" codigo="3687238"><nombre>Cartagena</nombre><pais>Colombia</pais><poblacion>952024</poblacion><ubicacion><latitud>10.39972</latitud><longitud>-75.51444</longitud></ubicacion><dbpedia>http://dbpedia.org/resource/Cartagena%2C_Colombia</dbpedia><wikipedia>https://en.wikipedia.org/wiki/Cartagena%2C_Colombia</wikipedia><fechaactualizacion>2018-04-20</fechaactualizacion><informacionmeteorologica><fechayhora>2019-04-26T22:00:00</fechayhora><nombreestacion>Cartagena / Rafael Nunez</nombreestacion><temperatura>31.0</temperatura><nubes>broken clouds</nubes></informacionmeteorologica><sitio codigo="3687237"><nombre>Acueducto Cartagena</nombre></sitio><sitio codigo="3689976"><nombre>Amberes</nombre></sitio><sitio codigo="3689126"><nombre>Barrio El Prado</nombre></sitio><sitio codigo="3689554"><nombre>Armenia</nombre></sitio><sitio codigo="3688474"><nombre>Bruselas</nombre></sitio><sitio codigo="9612088"><nombre>Movich Hotel Cartagena De Indias Slh</nombre></sitio><sitio codigo="9222770"><nombre>Cartagena Water Treatment Plant</nombre></sitio><sitio codigo="3675258"><nombre>Lomas de Mari√≥n</nombre></sitio><sitio codigo="10233251"><nombre>Hotel Avenida Buenos Aires</nombre></sitio></ciudad>